{
  "schema_version": "0.1.0",
  "case_id": "synthetic-schema-example",
  "model_id": "synthetic-model-5-inputs",
  "model_version": null,
  "model_sha256": "0000000000000000000000000000000000000000000000000000000000000000",
  "preprocessing_reference": {
    "bundle_type": "synthetic-fitted-transformer-fixture",
    "raw_input_order": ["number_a", "number_b", "category_a", "category_b", "category_c"],
    "training_feature_count": 5,
    "unused_training_features": [],
    "encoded_feature_count": 8,
    "selected_encoded_feature_count": 4,
    "transform_order": ["synthetic_transformer", "synthetic_mask", "synthetic_estimator"]
  },
  "input_feature_count": 5,
  "input_features": [
    {
      "name": "number_a",
      "data_type": "number",
      "required": true,
      "nullable": null,
      "control_type": "number",
      "control_type_evidence": "PROPOSED_FROM_NUMERIC_TRANSFORMER",
      "options": [],
      "unit": null,
      "minimum": null,
      "maximum": null,
      "evidence_status": "VERIFIED",
      "unknown_category_behavior": null,
      "api_allowlist_status": "NOT_APPLICABLE",
      "blank_policy": "REJECT_OR_NORMALIZE_BEFORE_TRANSFORM",
      "missing_policy": "UNKNOWN_NO_FITTED_IMPUTER",
      "missing_marker": null,
      "missing_evidence_status": "UNKNOWN",
      "encoded_features": ["number__number_a"]
    },
    {
      "name": "number_b",
      "data_type": "number",
      "required": true,
      "nullable": null,
      "control_type": "number",
      "control_type_evidence": "PROPOSED_FROM_NUMERIC_TRANSFORMER",
      "options": [],
      "unit": null,
      "minimum": null,
      "maximum": null,
      "evidence_status": "VERIFIED",
      "unknown_category_behavior": null,
      "api_allowlist_status": "NOT_APPLICABLE",
      "blank_policy": "REJECT_OR_NORMALIZE_BEFORE_TRANSFORM",
      "missing_policy": "UNKNOWN_NO_FITTED_IMPUTER",
      "missing_marker": null,
      "missing_evidence_status": "UNKNOWN",
      "encoded_features": ["number__number_b"]
    },
    {
      "name": "category_a",
      "data_type": "category",
      "required": true,
      "nullable": true,
      "control_type": "select",
      "control_type_evidence": "PROPOSED_BY_FITTED_CATEGORY_CARDINALITY",
      "options": [
        {"value": "A", "source": "FITTED_ENCODER_CATEGORY", "evidence_status": "VERIFIED", "infrequent": false, "api_allowlisted": false},
        {"value": "B", "source": "FITTED_ENCODER_CATEGORY", "evidence_status": "VERIFIED", "infrequent": false, "api_allowlisted": false}
      ],
      "unit": null,
      "minimum": null,
      "maximum": null,
      "evidence_status": "VERIFIED",
      "unknown_category_behavior": "ignore",
      "api_allowlist_status": "NOT_ESTABLISHED",
      "encoder_metadata": {"name": "OneHotEncoder", "minimum_frequency": null, "maximum_categories": null, "infrequent_category_count": 0},
      "blank_policy": "UNKNOWN_OR_UNKNOWN_CATEGORY",
      "missing_policy": "SIMPLE_IMPUTER_MOST_FREQUENT",
      "missing_marker": "NaN",
      "missing_evidence_status": "VERIFIED",
      "encoded_features": ["category__category_a_A", "category__category_a_B"]
    },
    {
      "name": "category_b",
      "data_type": "category",
      "required": true,
      "nullable": true,
      "control_type": "select",
      "control_type_evidence": "PROPOSED_BY_FITTED_CATEGORY_CARDINALITY",
      "options": [
        {"value": "X", "source": "FITTED_ENCODER_CATEGORY", "evidence_status": "VERIFIED", "infrequent": false, "api_allowlisted": false},
        {"value": "Y", "source": "FITTED_ENCODER_CATEGORY", "evidence_status": "VERIFIED", "infrequent": false, "api_allowlisted": false}
      ],
      "unit": null,
      "minimum": null,
      "maximum": null,
      "evidence_status": "VERIFIED",
      "unknown_category_behavior": "ignore",
      "api_allowlist_status": "NOT_ESTABLISHED",
      "encoder_metadata": {"name": "OneHotEncoder", "minimum_frequency": null, "maximum_categories": null, "infrequent_category_count": 0},
      "blank_policy": "UNKNOWN_OR_UNKNOWN_CATEGORY",
      "missing_policy": "SIMPLE_IMPUTER_MOST_FREQUENT",
      "missing_marker": "NaN",
      "missing_evidence_status": "VERIFIED",
      "encoded_features": ["category__category_b_X", "category__category_b_Y"]
    },
    {
      "name": "category_c",
      "data_type": "category",
      "required": true,
      "nullable": true,
      "control_type": "select",
      "control_type_evidence": "PROPOSED_BY_FITTED_CATEGORY_CARDINALITY",
      "options": [
        {"value": "north", "source": "FITTED_ENCODER_CATEGORY", "evidence_status": "VERIFIED", "infrequent": false, "api_allowlisted": false},
        {"value": "south", "source": "FITTED_ENCODER_CATEGORY", "evidence_status": "VERIFIED", "infrequent": false, "api_allowlisted": false}
      ],
      "unit": null,
      "minimum": null,
      "maximum": null,
      "evidence_status": "VERIFIED",
      "unknown_category_behavior": "ignore",
      "api_allowlist_status": "NOT_ESTABLISHED",
      "encoder_metadata": {"name": "OneHotEncoder", "minimum_frequency": null, "maximum_categories": null, "infrequent_category_count": 0},
      "blank_policy": "UNKNOWN_OR_UNKNOWN_CATEGORY",
      "missing_policy": "SIMPLE_IMPUTER_MOST_FREQUENT",
      "missing_marker": "NaN",
      "missing_evidence_status": "VERIFIED",
      "encoded_features": ["category__category_c_north", "category__category_c_south"]
    }
  ],
  "selected_encoded_features": [
    {"index": 0, "name": "number__number_a", "source_feature": "number_a"},
    {"index": 2, "name": "category__category_a_A", "source_feature": "category_a"},
    {"index": 4, "name": "category__category_b_X", "source_feature": "category_b"},
    {"index": 6, "name": "category__category_c_north", "source_feature": "category_c"}
  ],
  "raw_to_encoded_mapping": [
    {"raw_name": "number_a", "encoded_names": ["number__number_a"]},
    {"raw_name": "number_b", "encoded_names": ["number__number_b"]},
    {"raw_name": "category_a", "encoded_names": ["category__category_a_A", "category__category_a_B"]},
    {"raw_name": "category_b", "encoded_names": ["category__category_b_X", "category__category_b_Y"]},
    {"raw_name": "category_c", "encoded_names": ["category__category_c_north", "category__category_c_south"]}
  ],
  "source_evidence": {
    "run_id": "synthetic-run",
    "configuration_id": "synthetic-config",
    "source_data_sha256": "0000000000000000000000000000000000000000000000000000000000000000",
    "config_sha256": null,
    "code_sha256": null,
    "evidence_status": "PARTIAL",
    "manifest_verification": "NOT_PROVIDED"
  },
  "api_readiness": "BLOCKED_NOT_AN_API_ALLOWLIST_OR_ENDPOINT",
  "category_values_publication_review": "REQUIRED_BEFORE_PUBLICATION",
  "status": "MOCK"
}
